"CFIHOS unique ID","section","name","definition","note / comment","data source","change request number","status","created date","modified date","terminated date"
"CFIHOS-00000112","A.4.23","purchase order item for tag","A purchase order item that refers to one or more tags",,"Mix Owner/Operator and EPC","FR15","STANDARD","2021-10-06T17:17:05.556Z","2021-10-06T17:17:05.556Z",
"CFIHOS-00000113","A.5.31","process class","A classification of the process activities according to the type of action / operation being performed","DEXPI and ISO15926 provide good starting points for the list of process classes","RDL","FR43","STANDARD","2021-10-06T17:17:05.556Z","2021-10-06T17:17:05.556Z",
"CFIHOS-00000114","A.5.32","process class tag class relationship","A tag class that can be used to implement a process activity belonging to a process class",,"RDL","FR43","STANDARD","2021-10-06T17:17:05.556Z","2021-10-06T17:17:05.556Z",
"CFIHOS-00000115","A.5.33","process class property","A property that should be specified for process activities related to this process class",,"RDL","FR43","STANDARD","2021-10-06T17:17:05.556Z","2021-10-06T17:17:05.556Z",
"CFIHOS-00000116","A.5.34","process activity","A set of actions by which material, energy or information is transformed, transported or stored","Processes can be decomposed in sub processes, also known as process steps.","EPC","FR43","STANDARD","2021-10-06T17:17:05.556Z","2021-10-06T17:17:05.556Z",
"CFIHOS-00000117","A.5.35","process activity tag relationship","A tag that implements (part of) the functional requirements of a process activity",,"EPC","FR43","STANDARD","2021-10-06T17:17:05.556Z","2021-10-06T17:17:05.556Z",
"CFIHOS-00000118","A.5.36","process design property","A property that is required by a given process activity","This property is often the result of some governing case, to allow for all possible scenarios to be taken into account.","EPC","FR43","STANDARD","2021-10-06T17:17:05.556Z","2021-10-06T17:17:05.556Z",
"CFIHOS-00000119","A.5.37","stream class","A classification of the process streams according to what is being moved",,"RDL","FR43","STANDARD","2021-10-06T17:17:05.556Z","2021-10-06T17:17:05.556Z",
"CFIHOS-00000120","A.5.38","process stream","A flow of material, energy or information produced by one process activity and consumed by another process activity","A process stream depicts the interaction between process activities.","EPC","FR43","STANDARD","2021-10-06T17:17:05.556Z","2021-10-06T17:17:05.556Z",
"CFIHOS-00000121","A.5.39","stream class property","A property that should be specified for process streams related to this stream class",,"RDL","FR43","STANDARD","2021-10-06T17:17:05.556Z","2021-10-06T17:17:05.556Z",
"CFIHOS-00000122","A.5.40","process stream property","A property that is required for a process stream",,"EPC","FR43","STANDARD","2021-10-06T17:17:05.556Z","2021-10-06T17:17:05.556Z",
"CFIHOS-00000127","A.5.41","process case","A scenario of how processes and streams would perform under some conditions",,"EPC","FR51","STANDARD","2021-10-06T17:17:05.556Z","2021-10-06T17:17:05.556Z",
"CFIHOS-00000128","A.5.44","process stream in case","A process stream included in the scope of a case",,"EPC","FR51","STANDARD","2021-10-06T17:17:05.556Z","2021-10-06T17:17:05.556Z",
"CFIHOS-00000129","A.5.45","process stream property in case","A process stream property, in the context of a case",,"EPC","FR51","STANDARD","2021-10-06T17:17:05.556Z","2021-10-06T17:17:05.556Z",
"CFIHOS-00000130","A.5.42","process activity in case","A process activity included in the scope of a case",,"EPC","FR51","STANDARD","2021-10-06T17:17:05.556Z","2021-10-06T17:17:05.556Z",
"CFIHOS-00000131","A.5.43","process property in case","A property of a process activity, in the context of a case",,"EPC","FR51","STANDARD","2021-10-06T17:17:05.556Z","2021-10-06T17:17:05.556Z",
"CFIHOS-00000132","A.4.08","source standard document and data requirement","A requirement for document or data, as expressed in a source standard, irrespective of the equipment class","These  Document and Data Requirements are of two kinds:  - Design: Information generated during the design activity that has to be approved and reviewed by the purchaser.  - Equipment: Information generated by the equipment manufacturer.This entity represents how to best manage this data, as all document and data requirements expressed in a standard are independent of the equipment classess the standard is coveringIn the RDL, this table only contains the entries for document and data requirements as expressed in public standards.Owners / operators are expected to download them in their database, and then to complement that list with their own document and data requirements for their standards..","RDL","FR14","STANDARD","2021-10-06T17:17:05.556Z","2021-10-06T17:17:05.556Z",
"CFIHOS-00000133","A.6.16","handover event","A phase, a moment, at which handover of information is taking place",,"RDL Pick list","FR27","STANDARD","2021-10-06T17:17:05.556Z","2021-10-06T17:17:05.556Z",
"CFIHOS-00000134","A.6.17","discipline document type handover requirement","An indication of the status that a document type should have, if any, at a given handover phase, for a given discipline",,"RDL","FR27","STANDARD","2021-10-06T17:17:05.556Z","2021-10-06T17:17:05.556Z",
"CFIHOS-00000135","A.6.12","native file delivery timing","An indication of when the native file should be available",,"RDL","FR27","STANDARD","2021-10-06T17:17:05.556Z","2021-10-06T17:17:05.556Z",
"CFIHOS-00000137","A.4.27","deliverable format","A format required to be used by the supplier of information in conformance with JIP33 standard",,"RDL Pick list","FR74","STANDARD","2021-10-06T17:17:05.556Z","2021-10-06T17:17:05.556Z",
