"piping and pipeline equipment","piping spool","Is a piping assembly of piping components to be pre-fabricated as one item.","no","CFIHOS-30000182","no",,,"2019-10-01T00:47:46.434Z","2021-10-12T14:57:36.093Z",,"CR0005;CR0030;CR0029;FR60","STANDARD"
"IT and telecom equipment","positioning system","A handheld or fixed device designed to identify and record the location of an object on the earth's surface. GPS, GALILEO, SYLEDIS, HYPERFIX, LORAN-C, DECCA etc. are all brands and working on different networks.","no","CFIHOS-30000184","yes",,,"2019-10-01T00:47:46.434Z","2021-10-12T14:57:36.093Z",,"CR0005;CR0030;CR0029;FR60","STANDARD"
"flow element","positive displacement flow element","Elements like impellers rotating by the pressure of the fluid  in a closed conduit to measure the flow of a liquid.","no","CFIHOS-30000185","yes",,,"2019-10-01T00:47:46.434Z","2021-10-12T14:57:36.093Z",,"CR0002;CR0005;CR0014;CR0028;CR0029;CR0030;FR60","STANDARD"
"electrical equipment class","power stabiliser","A device that removes voltage spikes from an AC or DC electrical supply.","no","CFIHOS-30000186","yes",,"voltage regulator","2019-10-01T00:47:46.434Z","2021-10-12T14:57:36.093Z",,"CR0005;CR0012;CR0030;CR0029;FR60;FR74","STANDARD"
"instrument equipment","pressure instrument",,"yes","CFIHOS-30000187","no",,,"2019-10-01T00:47:46.434Z","2021-10-12T14:57:36.093Z","2021-10-12T14:57:36.093Z","CR0005;CR0014;CR0028;CR0029;FR60","TERMINATED"
"pressure instrument","pressure memory gauge","An instrument that measures and stores downhold pressures, enabling the data to be read when the tool assembly is returned to the surface.","no","CFIHOS-30000188","no",,,"2019-10-01T00:47:46.434Z","2021-10-12T14:57:36.093Z","2021-10-12T14:57:36.093Z","CR0002;CR0005;CR0014;CR0029;FR60","TERMINATED"
"IT and telecom equipment","process data acquisition and control","Is a facilty for measure & control, including the main plant computerized operational system, where all process, utility and off site activities are monitored. The system may be located in the main control room. (e.g. PLC Programmable logic controller, DCS distributed control system, ENMC Electrical Network Monitoring and Control system).","no","CFIHOS-30000189","yes",,"programmable logic controller; plc","2019-10-01T00:47:46.434Z","2021-10-12T14:57:36.093Z",,"CR0005;CR0012;CR0030;CR0029;FR60;FR74","STANDARD"
"general instrument","proximity amplifier","A device that increases the power or amplitude of a signal received from a proximity probe.","no","CFIHOS-30000190","yes",,,"2019-10-01T00:47:46.434Z","2021-10-12T14:57:36.093Z","2021-10-12T14:57:36.093Z","CR0005;CR0014;CR0029;FR60","TERMINATED"
"IT and telecom equipment","public address and alarm system","Is an alarm system.","no","CFIHOS-30000191","yes",,,"2019-10-01T00:47:46.434Z","2021-10-12T14:57:36.093Z",,"CR0005;CR0030;CR0029;FR60;FR74","STANDARD"
"valve instrument","RA ball valve","A valve designed to regulate flow. A valve which has a ball closure member. Includes an actuator that needs auxiliary power to operate.","no","CFIHOS-30000192","yes",,,"2019-10-01T00:47:46.434Z","2021-10-12T14:57:36.093Z","2021-10-12T14:57:36.093Z","CR0002;CR0005;CR0011;CR0029;FR60","TERMINATED"
"valve instrument","RA butterfly valve","A valve designed to regulate flow. A valve which has a closure member of a disk type with a shaft parallel, or near parallel, to the plane of the disk, with an axis of rotation transverse to the flow direction. Includes an actuator that needs auxiliary po","no","CFIHOS-30000193","yes",,,"2019-10-01T00:47:46.434Z","2021-10-12T14:57:36.093Z","2021-10-12T14:57:36.093Z","CR0002;CR0005;CR0011;CR0029;FR60","TERMINATED"
"valve (non DCS connected)","RA diaphragm valve","A valve designed to regulate flow. A membrane valve where the closure member is a resilient diaphragm being forced against a port. Includes an actuator that needs auxiliary power to operate.","no","CFIHOS-30000194","yes",,,"2019-10-01T00:47:46.434Z","2021-10-12T14:57:36.093Z","2021-10-12T14:57:36.093Z","CR0002;CR0005;CR0011;CR0029;FR60","TERMINATED"
"valve instrument","RA eccentric rotating disc valve","A valve designed to regulate flow. A valve which closing member is an eccentric rotating disc. Includes an actuator that needs auxiliary power to operate.","no","CFIHOS-30000195","yes",,,"2019-10-01T00:47:46.434Z","2021-10-12T14:57:36.093Z","2021-10-12T14:57:36.093Z","CR0002;CR0005;CR0011;CR0029;FR60","TERMINATED"
"valve instrument","RA globe valve","A valve designed to regulate flow. A valve where the closure member is a disk or piston operating with linear motion normal to the flat or shaped seat. Includes an actuator that needs auxiliary power to operate.","no","CFIHOS-30000196","yes",,,"2019-10-01T00:47:46.434Z","2021-10-12T14:57:36.093Z","2021-10-12T14:57:36.093Z","CR0002;CR0005;CR0011;CR0029;FR60","TERMINATED"
"valve instrument","RA needle valve","A valve designed to regulate flow. A globe valve with a closure member with the shape of a conical plug (needle) which closes into a small seat. Used for flow metering and damping pressure fluctuations on instruments, e.g. pressure gauge. Includes an actu","no","CFIHOS-30000197","yes",,,"2019-10-01T00:47:46.434Z","2021-10-12T14:57:36.093Z","2021-10-12T14:57:36.093Z","CR0002;CR0005;CR0011;CR0029;FR60","TERMINATED"
"valve instrument","RA plug valve","A valve designed to regulate flow. A valve with a quarter turn action in which the closure member is a cylindrical or tapered plug which operates by rotating on its axis and sealing against a downstream seat. Includes an actuator that needs auxiliary powe","no","CFIHOS-30000198","yes",,,"2019-10-01T00:47:46.434Z","2021-10-12T14:57:36.093Z","2021-10-12T14:57:36.093Z","CR0002;CR0005;CR0011;CR0029;FR60","TERMINATED"
"other mechanical equipment","rack","A mechanical structure intended to receive a number of pieces of basically standardized modular equipment.","no","CFIHOS-30000199","yes",,,"2019-10-01T00:47:46.434Z","2021-10-12T14:57:36.093Z",,"CR0005;CR0030;CR0029;FR60","STANDARD"
"level element","radar level element","An element intended to determine a level based on high frequency electromagnetic waves.","no","CFIHOS-30000200","yes",,,"2019-10-01T00:47:46.434Z","2021-10-12T14:57:36.093Z",,"CR0002;CR0005;CR0014;CR0028;CR0029;CR0030;FR60","STANDARD"
"heat exchanger","radiator","Is a heat exchanger which cools a fluid and heats the surrounding environment.","no","CFIHOS-30000201","yes",,,"2019-10-01T00:47:46.434Z","2021-10-12T14:57:36.093Z",,"CR0005;CR0030;CR0029;FR60","STANDARD"
"vehicle","radio caravan","A mobile radio communications centre.","no","CFIHOS-30000202","yes",,,"2019-10-01T00:47:46.434Z","2021-10-12T14:57:36.093Z",,"CR0005;CR0030;CR0029;FR60","STANDARD"
"IT and telecom equipment","radio transceiver","A transceiver which has the methods of signalling through space, without connecting wires.","no","CFIHOS-30000203","yes",,,"2019-10-01T00:47:46.434Z","2021-10-12T14:57:36.093Z",,"CR0005;CR0030;CR0029;FR60","STANDARD"
"IT and telecom equipment","reader","Is a piece of hardware intended to read and decode information encoded on a carrier.","no","CFIHOS-30000205","yes",,"computer peripheral","2019-10-01T00:47:46.434Z","2021-10-12T14:57:36.093Z",,"CR0005;CR0012;CR0030;CR0029;FR60","STANDARD"
"analysing instrument","redox analyser","An analyser intended to determine the oxidation and reduction capability of material.","no","CFIHOS-30000206","yes",,,"2019-10-01T00:47:46.434Z","2021-10-12T14:57:36.093Z",,"CR0002;CR0005;CR0029;CR0030;FR60","STANDARD"
"electrical equipment class","refrigerator","A refrigerator (often shortened to fridge)  is an electric appliance that uses refrigeration to help preserve food.","no","CFIHOS-30000207","yes",,,"2019-10-01T00:47:46.434Z","2021-10-12T14:57:36.093Z","2021-10-12T14:57:36.093Z","CR0005;CR0012;CR0029;FR60","TERMINATED"
"pressure transmitter","relative pressure transmitter","A pressure transmitter where pressure is applied to one side of the sensor while the other side is open to atmosphere. The transmitter generate standardized output signal representing the measured value.","no","CFIHOS-30000208","yes",,,"2019-10-01T00:47:46.434Z","2021-10-12T14:57:36.093Z",,"CR0002;CR0005;CR0014;CR0029;CR0030;FR60","STANDARD"
"electrical equipment class","remote terminal unit","A RTU, or Remote Terminal Unit is a device which interfaces objects in the physical world to a DCS or SCADA system by transmitting telemetry data to the system and/or altering the state of connected objects based on control messages received from the system.","no","CFIHOS-30000209","yes",,"rtu","2019-10-01T00:47:46.434Z","2021-10-12T14:57:36.093Z",,"CR0005;CR0012;CR0030;CR0029;FR60","STANDARD"
"infrastructure","residential building","Assigned for living and accommodation.","no","CFIHOS-30000210","no",,,"2019-10-01T00:47:46.434Z","2021-10-12T14:57:36.093Z",,"CR0005;CR0030;CR0029;FR60","STANDARD"
"valve (non DCS connected)","RM ball valve","A valve designed to regulate flow. A valve which has a ball closure member. Is manually operated.","no","CFIHOS-30000211","yes",,,"2019-10-01T00:47:46.434Z","2021-10-12T14:57:36.093Z","2021-10-12T14:57:36.093Z","CR0002;CR0005;CR0011;CR0029;FR60","TERMINATED"
"valve (non DCS connected)","RM butterfly valve","A valve designed to regulate flow. A valve which has a closure member of a disk type with a shaft parallel, or near parallel, to the plane of the disk, with an axis of rotation transverse to the flow direction. Is manually operated.","no","CFIHOS-30000212","yes",,,"2019-10-01T00:47:46.434Z","2021-10-12T14:57:36.093Z","2021-10-12T14:57:36.093Z","CR0002;CR0005;CR0011;CR0029;FR60","TERMINATED"
"valve (non DCS connected)","RM diaphragm valve","A valve designed to regulate flow. A membrane valve where the closure member is a resilient diaphragm being forced against a port. Is manually operated.","no","CFIHOS-30000213","yes",,,"2019-10-01T00:47:46.434Z","2021-10-12T14:57:36.093Z","2021-10-12T14:57:36.093Z","CR0002;CR0005;CR0011;CR0029;FR60","TERMINATED"
"valve (non DCS connected)","RM eccentric rotating disc valve","A valve designed to regulate flow. A valve which closing member is an eccentric rotating disc. Is manually operated.","no","CFIHOS-30000214","yes",,,"2019-10-01T00:47:46.434Z","2021-10-12T14:57:36.093Z","2021-10-12T14:57:36.093Z","CR0002;CR0005;CR0011;CR0029;FR60","TERMINATED"
"valve (non DCS connected)","RM globe valve","A valve designed to regulate flow. A valve where the closure member is a disk or piston operating with linear motion normal to the flat or shaped seat. Is manually operated.","no","CFIHOS-30000215","yes",,,"2019-10-01T00:47:46.434Z","2021-10-12T14:57:36.093Z","2021-10-12T14:57:36.093Z","CR0002;CR0005;CR0011;CR0029;FR60","TERMINATED"
"valve (non DCS connected)","RM needle valve","A valve designed to regulate flow. A globe valve with a closure member with the shape of a conical plug (needle) which closes into a small seat. Used for flow metering and damping pressure fluctuations on instruments, e.g. pressure gauge. Is manually oper","no","CFIHOS-30000216","yes",,,"2019-10-01T00:47:46.434Z","2021-10-12T14:57:36.093Z","2021-10-12T14:57:36.093Z","CR0002;CR0005;CR0011;CR0029;FR60","TERMINATED"
"valve (non DCS connected)","RM plug valve","A valve designed to regulate flow. A valve with a quarter turn action in which the closure member is a cylindrical or tapered plug which operates by rotating on its axis and sealing against a downstream seat. Is manually operated.","no","CFIHOS-30000217","yes",,,"2019-10-01T00:47:46.434Z","2021-10-12T14:57:36.093Z","2021-10-12T14:57:36.093Z","CR0002;CR0005;CR0011;CR0029;FR60","TERMINATED"
"infrastructure","road","Is a civil item intended for vehicle traffic.","no","CFIHOS-30000218","no",,,"2019-10-01T00:47:46.434Z","2021-10-12T14:57:36.093Z",,"CR0005;CR0030;CR0029;FR60","STANDARD"
"reciprocating pump","rod pump","Is a reciprocating pump using a rod attached to an assembly of check valves and other components. By the reciprocating movement of the rod liquid will be forced through the valves. These pumps are often driven by an air balancing unit.","no","CFIHOS-30000219","yes",,,"2019-10-01T00:47:46.434Z","2021-10-12T14:57:36.093Z","2021-10-12T14:57:36.093Z","CR0005;CR0009;CR0028;CR0029;FR60","TERMINATED"
"flow instrument","rotameter","A variable area flow indicator with a local reading indicator.","no","CFIHOS-30000220","no",,,"2019-10-01T00:47:46.434Z","2021-10-12T14:57:36.093Z","2021-10-12T14:57:36.093Z","CR0002;CR0005;CR0014;CR0029;FR60","TERMINATED"
"IT and telecom equipment","router","A router is a computer networking device that forwards data packets toward their destinations through a process known as routing. Routing occurs at layer 3 (Network layer) of the OSI seven-layer model.","no","CFIHOS-30000221","yes",,,"2019-10-01T00:47:46.434Z","2021-10-12T14:57:36.093Z",,"CR0005;CR0030;CR0029;FR60","STANDARD"
"electrical equipment class","safety barrier","Safety barriers are devices that limit the current, voltage, and total energy delivered to a sensor in a hazardous area or flammable environment in order to prevent an explosion.","no","CFIHOS-30000222","no",,,"2019-10-01T00:47:46.434Z","2021-10-12T14:57:36.093Z",,"CR0005;CR0014;CR0028;CR0030;CR0029;FR60;FR74","STANDARD"
"instrument equipment","safety valve instrument",,"yes","CFIHOS-30000223","no",,,"2019-10-01T00:47:46.434Z","2021-10-12T14:57:36.093Z","2021-10-12T14:57:36.093Z","CR0002;CR0005;CR0011;CR0029;FR60","TERMINATED"
"analysing instrument","sample loop component","A sample loop adds a predetermined volume to the process.","no","CFIHOS-30000224","yes",,,"2019-10-01T00:47:46.434Z","2021-10-12T14:57:36.093Z",,"CR0002;CR0005;CR0030;CR0029;FR60","STANDARD"
"IT and telecom equipment","satellite communications terminal","A system that provides voice and telefax communication via satellites.","no","CFIHOS-30000225","yes",,,"2019-10-01T00:47:46.434Z","2021-10-12T14:57:36.093Z",,"CR0005;CR0030;CR0029;FR60;FR74","STANDARD"
"conveyor","screw conveyor","Is a conveyer intended to move dry, solid material from one location to another by means of a helix or screw rotating in a cylindrical conduit.","no","CFIHOS-30000226","yes",,,"2019-10-01T00:47:46.434Z","2021-10-12T14:57:36.093Z",,"CR0005;CR0030;CR0029;FR60;FR74","STANDARD"
"control switch","selector switch","A manual control switch which has more then two possible positioning states.","no","CFIHOS-30000227","yes",,,"2019-10-01T00:47:46.434Z","2021-10-12T14:57:36.093Z",,"CR0002;CR0005;CR0014;CR0029;CR0030;FR60","STANDARD"
"other mechanical equipment","shale shaker","A vibrating screen for sifting out rock cuttings from drilling mud.","no","CFIHOS-30000228","yes",,,"2019-10-01T00:47:46.434Z","2021-10-12T14:57:36.093Z",,"CR0005;CR0030;CR0029;FR60","STANDARD"
"mechanical equipment class","other mechanical equipment","N equipment class that contains classes that normally are the responsibility of a department for mechanical engineering that are not covered by the mechanical equipment class.","yes","CFIHOS-30000230","no",,,"2019-10-01T00:47:46.434Z","2021-10-12T14:57:36.093Z",,"CR0005;CR0030;CR0029;FR60;FR74","STANDARD"
"other mechanical equipment","sheave","A wheel which is grooved for use with vee-belts, ropes, round belts, wire or pipe.","no","CFIHOS-30000231","yes",,,"2019-10-01T00:47:46.434Z","2021-10-12T14:57:36.093Z",,"CR0005;CR0030;CR0029;FR60","STANDARD"
"damper","shut off damper","A damper intended for closing off parts of a ventilation system.","no","CFIHOS-30000232","yes",,,"2019-10-01T00:47:46.434Z","2021-10-12T14:57:36.093Z",,"CR0005;CR0030;CR0029;FR60","STANDARD"
"miscellaneous equipment","side pocket mandrel","A completion component that is used to house gas-lift valves and similar devices that require communication with the annulus.","no","CFIHOS-30000233","yes",,,"2019-10-01T00:47:46.434Z","2021-10-12T14:57:36.093Z",,"CR0005;CR0030;CR0029;FR60","STANDARD"
"IT and telecom equipment","signal splitter","A device with one input and at least two outputs used for dividing a detectable transmitted energy (as a voltage, current, or  magnetic field strength) by which information can be transmitted.","no","CFIHOS-30000235","yes",,,"2019-10-01T00:47:46.434Z","2021-10-12T14:57:36.093Z",,"CR0005;CR0012;CR0030;CR0029;FR60;FR74","STANDARD"
"marine","single buoy mooring","A Single buoy mooring (SBM) or Single point mooring (SPM) is a loading buoy anchored offshore that serves as a mooring point and interconnect for tankers loading or offloading gas or fluid products. SBMs are the link between the geostatic subsea manifold connections and the weathervaning tanker. They are capable of handling any size ship, even very large crude carriers (VLCC) where no alternative facility is available.","no","CFIHOS-30000236","yes",,,"2019-10-01T00:47:46.434Z","2021-10-12T14:57:36.093Z",,"CR0005;CR0030;CR0029;FR60","STANDARD"
"health, safety and environment equipment class","sink","A large basin with taps that supplies water.","no","CFIHOS-30000237","yes",,,"2019-10-01T00:47:46.434Z","2021-10-12T14:57:36.093Z",,"CR0005;CR0030;CR0029;FR60","STANDARD"
"other mechanical equipment","skimmer","Device which separates oil from water by mechanically wipe the oil of the water surface.","no","CFIHOS-30000239","yes",,,"2019-10-01T00:47:46.434Z","2021-10-12T14:57:36.093Z",,"CR0005;CR0030;CR0029;FR60","STANDARD"
"lifting device","snatch block","A block through which a rope can be reeved without access to an end.","no","CFIHOS-30000240","yes",,,"2019-10-01T00:47:46.434Z","2021-10-12T14:57:36.093Z",,"CR0005;CR0030;CR0029;FR60","STANDARD"
"analysing instrument","solid composition analyser","An analyser intended to determine a mixture of solid particles in liquids or solid or liquid droplets in air.","no","CFIHOS-30000242","yes",,,"2019-10-01T00:47:46.434Z","2021-10-12T14:57:36.093Z",,"CR0002;CR0005;CR0029;CR0030;FR60","STANDARD"
"detector","sand detector","A detector intended to detect sand in a fluid.","no","CFIHOS-30000243","yes",,,"2019-10-01T00:47:46.434Z","2021-10-12T14:57:36.093Z",,"CR0002;CR0005;CR0014;CR0028;CR0030;CR0029;FR60","STANDARD"
"damper","sound attenuator","A device decreasing noise in a HVAC system.","no","CFIHOS-30000244","yes",,,"2019-10-01T00:47:46.434Z","2021-10-12T14:57:36.093Z",,"CR0005;CR0030;CR0029;FR60","STANDARD"
"analysing instrument","sound pressure level analyser","A meter intended to measure a sound pressure level.","no","CFIHOS-30000245","yes",,,"2019-10-01T00:47:46.434Z","2021-10-12T14:57:36.093Z",,"CR0002;CR0005;CR0029;CR0030;FR60","STANDARD"
"piping and pipeline equipment","spark arrestor","A device which removes incandescent particles from a gas stream. Spark arrestors are fitted to vehicles and stationary engines which are operated in potentially flammable atmospheres.","no","CFIHOS-30000246","yes",,,"2019-10-01T00:47:46.434Z","2021-10-12T14:57:36.093Z",,"CR0005;CR0030;CR0029;FR60","STANDARD"
"tool","special tool","A device that is made as a tool to be used for a special purpose.","no","CFIHOS-30000247","yes",,,"2019-10-01T00:47:46.434Z","2021-10-12T14:57:36.093Z",,"CR0005;CR0030;CR0029;FR60","STANDARD"
"analysing instrument","specific gravity analyser","An analyser intended to determine specific gravity's of materials. Typically of liquids.","no","CFIHOS-30000248","yes",,,"2019-10-01T00:47:46.434Z","2021-10-12T14:57:36.093Z",,"CR0002;CR0005;CR0029;CR0030;FR60","STANDARD"
"other mechanical equipment","spreader bar","A beam that is used to spread ropes or slings when lifting.","no","CFIHOS-30000249","yes",,,"2019-10-01T00:47:46.434Z","2021-10-12T14:57:36.093Z",,"CR0005;CR0030;CR0029;FR60;FR74","STANDARD"
"piping and pipeline equipment","spring support","Is a support (item) intended to carry the load of piping components.","no","CFIHOS-30000250","no",,,"2019-10-01T00:47:46.434Z","2021-10-12T14:57:36.093Z",,"CR0005;CR0030;CR0029;FR60;FR74","STANDARD"
"other mechanical equipment","stack","Is a support structure intended to support a flare or vent pipe.","no","CFIHOS-30000251","yes",,,"2019-10-01T00:47:46.434Z","2021-10-12T14:57:36.093Z",,"CR0005;CR0030;CR0029;FR60","STANDARD"
"general instrument","strain gauge","Is a device used to measure deformation (strain) of an object. The most common type of strain gauge consists of a flexible backing which supports a metallic foil pattern etched onto the backing. As the object is deformed, the foil pattern is deformed, cau","no","CFIHOS-30000252","no",,,"2019-10-01T00:47:46.434Z","2021-10-12T14:57:36.093Z","2021-10-12T14:57:36.093Z","CR0005;CR0012;CR0014;CR0029;FR60;FR74","TERMINATED"
"other mechanical equipment","stroke length adjuster","A mechanical device capable of reducing the stroke length of a pump.","no","CFIHOS-30000253","yes",,,"2019-10-01T00:47:46.434Z","2021-10-12T14:57:36.093Z",,"CR0005;CR0030;CR0029;FR60","STANDARD"
"mechanical equipment class","sump","Is an artefact intended to collect a heavy phase by making use of gravity.","no","CFIHOS-30000254","yes",,"pit","2019-10-01T00:47:46.434Z","2021-10-12T14:57:36.093Z",,"CR0005;CR0013;CR0030;CR0029;FR60","STANDARD"
"other mechanical equipment","swivel joint","An artefact joining two parts so that one or both can pivot freely (as on a bolt or pin).","no","CFIHOS-30000255","yes",,,"2019-10-01T00:47:46.434Z","2021-10-12T14:57:36.093Z",,"CR0005;CR0030;CR0029;FR60","STANDARD"
"mechanical equipment class","tank and vessel",,"yes","CFIHOS-30000256","no",,,"2019-10-01T00:47:46.434Z","2021-10-12T14:57:36.093Z","2021-10-12T14:57:36.093Z","CR0005;CR0013;CR0029;FR60","TERMINATED"
"IT and telecom equipment","tape drive","A device that transfer data between a computer and a magnetic tape.","no","CFIHOS-30000257","yes",,,"2019-10-01T00:47:46.434Z","2021-10-12T14:57:36.093Z",,"CR0005;CR0030;CR0029;FR60","STANDARD"
"instrument equipment","temperature instrument","A physical object that detects temperatures; records, modifies and/or displays or performs a combination of these activities.","no","CFIHOS-30000258","yes",,,"2019-10-01T00:47:46.434Z","2021-10-12T14:57:36.093Z",,"CR0005;CR0014;CR0029;CR0030;CR0032;FR60","STANDARD"
"flow element","thermal flow element","An element which uses the principle of thermal conductivity to measure volume flow rate.","no","CFIHOS-30000259","yes",,,"2019-10-01T00:47:46.434Z","2021-10-12T14:57:36.093Z",,"CR0002;CR0005;CR0014;CR0028;CR0029;CR0030;FR60","STANDARD"
"flow transmitter","thermal flow transmitter","A velocity flow meter which uses the principle of thermal conductivity to measure volume flow rate.","no","CFIHOS-30000260","yes",,,"2019-10-01T00:47:46.434Z","2021-10-12T14:57:36.093Z",,"CR0002;CR0005;CR0014;CR0029;CR0030;FR60","STANDARD"
"equipment class","tool","A device that is a mechanical implement for working upon something, as by cutting, striking, rubbing or other processes, in any manual art or industry; usually, one held in and operated by the hand (or fixed in position, as in a lath), but also including certain simple machines, as the lathe; sometimes extended to simple instruments of other kinds.","yes","CFIHOS-30000261","no",,,"2019-10-01T00:47:46.434Z","2021-10-12T14:57:36.093Z",,"CR0005;CR0030;CR0029;FR60","STANDARD"
"flow instrument","totalizer","A Control Function which has the capability to totalize","no","CFIHOS-30000262","no",,,"2019-10-01T00:47:46.434Z","2021-10-12T14:57:36.093Z","2021-10-12T14:57:36.093Z","CR0002;CR0005;CR0014;CR0029;FR60","TERMINATED"
"vehicle","trailer","Is a vehicle which is nonautomotive and is designed to be hauled by road.","no","CFIHOS-30000263","yes",,,"2019-10-01T00:47:46.434Z","2021-10-12T14:57:36.093Z",,"CR0005;CR0030;CR0029;FR60","STANDARD"
"flow transmitter","turbine flow transmitter","A transmitter specially designed to convert the signal in a turbine meter into a standardized output signal.","no","CFIHOS-30000264","yes",,,"2019-10-01T00:47:46.434Z","2021-10-12T14:57:36.093Z",,"CR0002;CR0005;CR0014;CR0029;CR0030;FR60","STANDARD"
"flow transmitter","ultrasonic flow transmitter","A flow transmitter providing electrical outputs that are proportional to the flow inputs from an ultrasonic flow meter.","no","CFIHOS-30000265","yes",,,"2019-10-01T00:47:46.434Z","2021-10-12T14:57:36.093Z",,"CR0002;CR0005;CR0014;CR0029;CR0030;FR60","STANDARD"
"level element","ultrasonic level element","An element intended to determine a level based on  ultrasonic sound waves.","no","CFIHOS-30000266","yes",,,"2019-10-01T00:47:46.434Z","2021-10-12T14:57:36.093Z",,"CR0002;CR0005;CR0014;CR0028;CR0029;CR0030;FR60","STANDARD"
"miscellaneous equipment","umbilical","An assembly of hydraulic hoses which can also include electrical cables or optic fibres, used to control a sub sea structure or remote operated vehicle from a platform or a vessel.","no","CFIHOS-30000267","yes",,,"2019-10-01T00:47:46.434Z","2021-10-12T14:57:36.093Z",,"CR0005;CR0030;CR0029;FR60","STANDARD"
"electrical equipment class","UV sterilizer","Is a sterilizer intended to make use of ultraviolet light.","no","CFIHOS-30000268","yes",,,"2019-10-01T00:47:46.434Z","2021-10-12T14:57:36.093Z",,"CR0005;CR0030;CR0029;FR60","STANDARD"
"instrument equipment","valve (non DCS connected)",,"yes","CFIHOS-30000269","yes",,,"2019-10-01T00:47:46.434Z","2021-10-12T14:57:36.093Z","2021-10-12T14:57:36.093Z","CR0002;CR0005;CR0011;CR0029;FR60","TERMINATED"
"instrument equipment","valve instrument",,"yes","CFIHOS-30000270","no",,,"2019-10-01T00:47:46.434Z","2021-10-12T14:57:36.093Z","2021-10-12T14:57:36.093Z","CR0002;CR0005;CR0011;CR0029;FR60","TERMINATED"
"analysing instrument","vapour pressure analyser","An analyser intended to determine a vapor pressure.","no","CFIHOS-30000271","yes",,,"2019-10-01T00:47:46.434Z","2021-10-12T14:57:36.093Z",,"CR0002;CR0005;CR0029;CR0030;FR60;FR74","STANDARD"
