"subsea tool","subsea remote operated tool","Dedicated, unmanned, subsea tools used for installation and inspection, maintenance, and repair (IMR) tasks that require lift and/or handling capacity beyond that of free-swimming ROV systems.","no","CFIHOS-30000723","yes","missing from CFIHOS - in other OO RDLs",,"2019-10-01T00:47:46.434Z","2021-10-12T14:57:36.093Z",,"CR0015;CR0029;FR60","STANDARD"
"subsea tool","subsea remotely operated vehicle","A submarine which is a nearly neutral buoyancy submarine that is manipulated from a mother ship by an umbilical.","no","CFIHOS-30000724","yes","missing from CFIHOS - in other OO RDLs",,"2019-10-01T00:47:46.434Z","2021-10-12T14:57:36.093Z",,"CR0015;CR0029;FR60","STANDARD"
"subsea instrument equipment","subsea umbilical","A umbilical for use subsea or between a surface station (e.g. platform) and a subsea Installation.","no","CFIHOS-30000725","yes","missing from CFIHOS - in other OO RDLs",,"2019-10-01T00:47:46.434Z","2021-10-12T14:57:36.093Z",,"CR0015;CR0026;CR0030;CR0029;FR60","STANDARD"
"subsea instrument equipment","umbilical termination assembly","A termination head for a umbilical, having means for aligning fluid, electrical and optical lines to a mating assembly.","no","CFIHOS-30000726","yes","missing from CFIHOS - in other OO RDLs",,"2019-10-01T00:47:46.434Z","2021-10-12T14:57:36.093Z",,"CR0015;CR0029;FR60","STANDARD"
"electrical equipment class","electrical isolator","An isolator that isolates electrical conductors.","no","CFIHOS-30000727","yes","missing from CFIHOS - in other OO RDLs",,"2019-10-01T00:47:46.434Z","2021-10-12T14:57:36.093Z",,"CR0012;CR0029;FR60","STANDARD"
"relay","protection relay","A measuring relay that, either solely or in combination with other relays, is a constituent of a protection equipment.","no","CFIHOS-30000728","yes","missing from CFIHOS - in other OO RDLs","protective relay","2019-10-01T00:47:46.434Z","2021-10-12T14:57:36.093Z",,"CR0012;CR0029;FR60","STANDARD"
"switchgear and controlgear","ring main unit","A physical object that is a totally sealed, gas-insulated compact switchgear unit. The primary switching devices can be either switch disconnectors or fused switch disconnectors or circuit breakers.","no","CFIHOS-30000729","yes","missing from CFIHOS - in other OO RDLs","electrical ring main unit","2019-10-01T00:47:46.434Z","2021-10-12T14:57:36.093Z",,"CR0012;CR0029;FR60","STANDARD"
"electrical equipment class","automatic switching equipment","A physical object that is automatic and designed to initiate the operation of circuit-breakers and/or disconnectors in a substation according to a specific programme.","no","CFIHOS-30000731","yes","missing from CFIHOS - in other OO RDLs","transfer switch; ATS; electrical transfer switch","2019-10-01T00:47:46.434Z","2021-10-12T14:57:36.093Z",,"CR0012;CR0029;FR60","STANDARD"
"electrical equipment class","surge protection","A physical object that is protecting against a large but momentary increase in the voltage of an electric circuit.","no","CFIHOS-30000732","yes","missing from CFIHOS - in other OO RDLs","surge arrestor; lightning arrestor; surge protection device","2019-10-01T00:47:46.434Z","2021-10-12T14:57:36.093Z",,"CR0012;CR0029;FR60","STANDARD"
"electrical equipment class","capacitor","A physical object that stores electricity during part of an operation.","no","CFIHOS-30000733","yes","missing from CFIHOS - in other OO RDLs",,"2019-10-01T00:47:46.434Z","2021-10-12T14:57:36.093Z",,"CR0012;CR0029;FR60","STANDARD"
"electrical equipment class","electrical connector","A connector for holding two parts of a conductor in intimate contact.","no","CFIHOS-30000734","yes","missing from CFIHOS - in other OO RDLs",,"2019-10-01T00:47:46.434Z","2021-10-12T14:57:36.093Z",,"CR0012;CR0029;FR60","STANDARD"
"electrical equipment class","electrical distribution unit","An electrical conductor that has several power distribution points.","no","CFIHOS-30000735","yes","missing from CFIHOS - in other OO RDLs","distributer frame; distribution frame","2019-10-01T00:47:46.434Z","2021-10-12T14:57:36.093Z",,"CR0012;CR0029;FR60","STANDARD"
"subsea instrument equipment","subsea control module","A control module that is used to control a subsea production system.","no","CFIHOS-30000736","no","Required by owner-operators",,"2019-10-01T00:47:46.434Z","2021-10-12T14:57:36.093Z",,"CR0028;CR0029;FR60","STANDARD"
"subsea structure","subsea guide base","A subsea fixed structure supporting a wellhead.","no","CFIHOS-30000737","yes","Required by owner-operators",,"2019-10-01T00:47:46.434Z","2021-10-12T14:57:36.093Z",,"CR0028;CR0029;FR60","STANDARD"
"control valve","motor operated valve","An operated valve that is opened and closed with a motor.","no","CFIHOS-30000738","yes","Required by owner-operators",,"2019-10-01T00:47:46.434Z","2021-10-12T14:57:36.093Z",,"CR0028;CR0029;FR60","STANDARD"
"other mechanical equipment","shear ram","A shear valve is a ram-type BOP, similar in operation to a gate valve, but uses a pair of opposing steel plungers, rams. The rams extend toward the centre of the wellbore to restrict flow or retract open in order to permit flow.","no","CFIHOS-30000739","no","Required by owner-operators",,"2019-10-01T00:47:46.434Z","2021-10-14T10:16:00.083Z",,"CR0028;CR0029;FR60","STANDARD"
"electrical equipment class","solar panel","A panel and a photovoltaic module whose main parts are solar cells.","no","CFIHOS-30000740","yes","Required by owner-operators",,"2019-10-01T00:47:46.434Z","2021-10-12T14:57:36.093Z",,"CR0028;CR0029;FR60","STANDARD"
"general instrument","calorimeter","Intended to measure quantities of absorbed or evolved heat or to determine specific heats.","no","CFIHOS-30000742","yes","Required by owner-operators",,"2019-10-01T00:47:46.434Z","2021-10-12T14:57:36.093Z",,"CR0005;CR0028;CR0030;CR0029;FR60;FR74","STANDARD"
"general instrument","frequency generator","A device that generates an electrical signal of a specified frequency.","no","CFIHOS-30000743","yes","Required by owner-operators",,"2019-10-01T00:47:46.434Z","2021-10-12T14:57:36.093Z",,"CR0005;CR0028;CR0030;CR0029;FR60","STANDARD"
"general instrument","siren","An acoustic device producing a loud sound as a signal or warning.","no","CFIHOS-30000744","yes","Required by owner-operators",,"2019-10-01T00:47:46.434Z","2021-10-12T14:57:36.093Z",,"CR0005;CR0028;CR0030;CR0029;FR60;FR74","STANDARD"
"general instrument","current transformer","An instrument transformer in which the secondary current, in normal conditions of use, is substantially proportional to the primary current and differs in phase from it by an angle which is approximately zero for an appropriate direction of the connections.","no","CFIHOS-30000745","yes","Required by owner-operators",,"2019-10-01T00:47:46.434Z","2021-10-12T14:57:36.093Z",,"CR0005;CR0012;CR0014;CR0028;CR0030;CR0029;FR60","STANDARD"
"general instrument","voltage transformer","An instrument transformer in which the secondary voltage, in normal conditions of use, is substantially proportional to the primary voltage and differs in phase from it by an angle which is approximately zero for an appropriate direction of the connections.","no","CFIHOS-30000746","yes","Required by owner-operators",,"2019-10-01T00:47:46.434Z","2021-10-12T14:57:36.093Z",,"CR0005;CR0012;CR0014;CR0028;CR0030;CR0029;FR60","STANDARD"
"general instrument","alarm unit","A physical object that is intended to process and annunciate alarms.","no","CFIHOS-30000747","yes","Required by owner-operators",,"2019-10-01T00:47:46.434Z","2021-10-12T14:57:36.093Z",,"CR0005;CR0028;CR0030;CR0029;FR60","STANDARD"
"general instrument","flow computer","A computer that is specially designed and programme to calculate flow and to correct for external influence.","no","CFIHOS-30000748","yes","Required by owner-operators",,"2019-10-01T00:47:46.434Z","2021-10-12T14:57:36.093Z",,"CR0005;CR0028;CR0030;CR0029;FR60","STANDARD"
"general instrument","sight glass","A physical object that is transparent and intended for viewing a vessel or piping system interior.","no","CFIHOS-30000749","no","Required by owner-operators",,"2019-10-01T00:47:46.434Z","2021-10-12T14:57:36.093Z",,"CR0005;CR0014;CR0028;CR0030;CR0029;FR60","STANDARD"
"detecting element","rotational speed element","A detecting element that is intended to sense rotational speed.","no","CFIHOS-30000750","yes","Required by owner-operators","rotational speed sensor","2019-10-01T00:47:46.434Z","2021-10-12T14:57:36.093Z",,"CR0028;CR0029;FR60","STANDARD"
"transmitter","corrosion transmitter","A transmitter that is producing a standardized output signal dependent of a received input signal from a corrosion sensor.","no","CFIHOS-30000751","yes","Required by owner-operators",,"2019-10-01T00:47:46.434Z","2021-10-12T14:57:36.093Z",,"CR0028;CR0029;FR60","STANDARD"
"heat exchanger","plate heat exchanger","A heat exchanger using plates as the device for separating the two fluids and across which the energy is transferred.","no","CFIHOS-30000752","yes","Required by owner-operators","plate and frame heat exchanger","2019-10-01T00:47:46.434Z","2021-10-12T14:57:36.093Z",,"CR0005;CR0013;CR0028;CR0030;CR0029;FR60","STANDARD"
"heat exchanger","printed circuit heat exchanger","A non-corrugated plate heat exchanger that has flat plates with chemically etched flow passages which are diffusion bonded together into blocks.","no","CFIHOS-30000754","yes","Required by owner-operators",,"2019-10-01T00:47:46.434Z","2021-10-12T14:57:36.093Z",,"CR0005;CR0028;CR0030;CR0029;FR60","STANDARD"
"heat exchanger","shell and tube heat exchanger","A tubular heat exchanger in which a tube bundle is surrounded by a shell.","no","CFIHOS-30000755","yes","Required by owner-operators",,"2019-10-01T00:47:46.434Z","2021-10-12T14:57:36.093Z",,"CR0005;CR0028;CR0030;CR0029;FR60","STANDARD"
"heat exchanger","kettle reboiler","A reboiler often boils liquid coming from the bottom of a distillation column, after which the resulting vapour is returned to the distillation column.","no","CFIHOS-30000756","yes","missing from CFIHOS - in other OO RDLs Required by owner-operators",,"2019-10-01T00:47:46.434Z","2021-10-12T14:57:36.093Z",,"CR0013;CR0028;CR0029;FR60","STANDARD"
"vessel","pneumatic cylinder","A cylinder where the piston is actuated by compressed air.","no","CFIHOS-30000757","yes","Required by owner-operators",,"2019-10-01T00:47:46.434Z","2021-10-12T14:57:36.093Z",,"CR0028;CR0029;FR60","STANDARD"
"vessel","process reactor","A vessel intended to enable a chemical reaction process.","no","CFIHOS-30000758","yes","Required by owner-operators",,"2019-10-01T00:47:46.434Z","2021-10-12T14:57:36.093Z",,"CR0028;CR0029;FR60","STANDARD"
"vessel","hopper","A vessel with a conical shape for filling or dosing purposes.","no","CFIHOS-30000759","yes","Required by owner-operators",,"2019-10-01T00:47:46.434Z","2021-10-12T14:57:36.093Z",,"CR0028;CR0029;FR60","STANDARD"
"process column","absorber column","A column in which a gas mixture is contacted with a liquid for the purpose of preferentially dissolving one or more components of the gas mixture and to provide a solution of them in the liquid.","no","CFIHOS-30000800","yes","missing from CFIHOS - in other OO RDLs",,"2019-10-01T00:47:46.434Z","2021-10-12T14:57:36.093Z",,"CR0013;CR0029;FR60","STANDARD"
"electrical connector","adaptor connector","An electrical connector that is a fixed or free component that permits electrical connection(s) between two or more connectors where direct connection is mechanically impossible.","no","CFIHOS-30000801","yes","missing from CFIHOS - in other OO RDLs",,"2019-10-01T00:47:46.434Z","2021-10-12T14:57:36.093Z",,"CR0012;CR0029;FR60","STANDARD"
"process column","adsorber column","A physical fluid separator that is based on the principle of attraction exhibited by the surface of a solid for a liquid or a gas when they are in contact.","no","CFIHOS-30000802","yes","missing from CFIHOS - in other OO RDLs",,"2019-10-01T00:47:46.434Z","2021-10-12T14:57:36.093Z",,"CR0013;CR0029;FR60","STANDARD"
"circuit-breaker","air circuit-breaker","A circuit-breaker in which the contacts open and close in air at atmospheric pressure.","no","CFIHOS-30000803","yes","missing from CFIHOS - in other OO RDLs",,"2019-10-01T00:47:46.434Z","2021-10-12T14:57:36.093Z",,"CR0012;CR0029;FR60","STANDARD"
"electric generator","alternating current generator","An electric generator for the production of alternating current and voltage.","no","CFIHOS-30000804","yes","BP Tagging Specification","AC electric generator; AC generator","2019-10-01T00:47:46.434Z","2021-10-12T14:57:36.093Z",,"CR0009;CR0029;FR60","STANDARD"
"electric motor","alternating current motor","An electric motor driven by alternating electric current.","no","CFIHOS-30000805","yes","BP Tagging Specification","AC electric motor;AC induction electric motor;AC synchronous electric motor","2019-10-01T00:47:46.434Z","2021-10-12T14:57:36.093Z",,"CR0009;CR0029;FR60","STANDARD"
"control valve","ball control valve","A ball valve that is equipped with an actuator that manipulates a stream of fluid in the response to a signal from an external sensing element and with input of energy from an external source.","no","CFIHOS-30000806","yes","Identified as part of RDL Alignment Activity","actuated ball valve","2019-10-01T00:47:46.434Z","2021-10-12T14:57:36.093Z",,"CR0011;CR0029;FR60","STANDARD"
"manual valve","ball valve","A rotary valve that has a ball closure member.","no","CFIHOS-30000807","yes","Identified as part of RDL Alignment Activity",,"2019-10-01T00:47:46.434Z","2021-10-12T14:57:36.093Z",,"CR0011;CR0029;FR60","STANDARD"
"manual valve","block and bleed valve","A valve that has one seat which provides a seal, and a bleeder line and valve that are tapped into the block valve's bonnet.","no","CFIHOS-30000808","yes","Identified as part of RDL Alignment Activity",,"2019-10-01T00:47:46.434Z","2021-10-12T14:57:36.093Z",,"CR0011;CR0029;FR60","STANDARD"
"control valve","butterfly control valve","A butterfly valve that is equipped with an actuator that manipulates a stream of fluid in the response to a signal from an external sensing element and with input of energy from an external source.","no","CFIHOS-30000809","yes","Identified as part of RDL Alignment Activity","actuated butterfly valve","2019-10-01T00:47:46.434Z","2021-10-12T14:57:36.093Z",,"CR0011;CR0029;FR60","STANDARD"
"manual valve","butterfly valve","A rotary valve that has a closure member of a disc type with a shaft parallel, or near parallel, to the plane of the disc, with an axis of rotation transverse to the flow direction.","no","CFIHOS-30000810","yes","Identified as part of RDL Alignment Activity",,"2019-10-01T00:47:46.434Z","2021-10-12T14:57:36.093Z",,"CR0011;CR0029;FR60","STANDARD"
"control valve","choke control valve","A choke valve that is equipped with an actuator that manipulates a stream of fluid in the response to a signal from an external sensing element and with input of energy from an external source.","no","CFIHOS-30000811","yes","Identified as part of RDL Alignment Activity","actuated choke valve","2019-10-01T00:47:46.434Z","2021-10-12T14:57:36.093Z",,"CR0011;CR0029;FR60","STANDARD"
"manual valve","choke valve","A valve that can be used to obstruct the fluid passing inside, and has the ability to reduce the pressure from the inlet port to the outlet port.","no","CFIHOS-30000812","yes","Identified as part of RDL Alignment Activity",,"2019-10-01T00:47:46.434Z","2021-10-12T14:57:36.093Z",,"CR0011;CR0029;FR60","STANDARD"
"analysing instrument","chromatograph","An analysing instrument that applies the principle of chromatography to analyse the molecular composition of a substance.","yes","CFIHOS-30000813","no","Owner Operator RDL Alignment",,"2019-10-01T00:47:46.434Z","2021-10-12T14:57:36.093Z",,"CR0014;CR0029;FR60","STANDARD"
"process column","contactor column","A pressure vessel with internal packing intended to effect the main stream by introducing counter flow of a regenerative liquid or gas. Dehydration of gas by use of glycol is a typical application.","no","CFIHOS-30000814","yes","missing from CFIHOS - in other OO RDLs",,"2019-10-01T00:47:46.434Z","2021-10-12T14:57:36.093Z",,"CR0013;CR0029;FR60","STANDARD"
"relief valve","conventional relief valve","A pressure relief valve that has its closing force provided by a spring.","no","CFIHOS-30000815","yes","Identified as part of RDL Alignment Activity","conventional pressure safety valve","2019-10-01T00:47:46.434Z","2021-10-12T14:57:36.093Z",,"CR0011;CR0029;FR60","STANDARD"
"mechanical equipment class","cyclone separator","A separator intended to separate by rotation based on difference in densities","yes","CFIHOS-30000816","yes","missing from CFIHOS - in other OO RDLs","cyclone","2019-10-01T00:47:46.434Z","2021-10-21T13:27:58.097Z","2021-10-21T13:27:58.097Z","CR0013;CR0029;FR60;FR74","TERMINATED"
"control valve","diaphragm control valve","A diaphragm valve that is equipped with an actuator that manipulates a stream of fluid in the response to a signal from an external sensing element and with input of energy from an external source.","no","CFIHOS-30000817","yes","Identified as part of RDL Alignment Activity","actuated diaphragm valve","2019-10-01T00:47:46.434Z","2021-10-12T14:57:36.093Z",,"CR0011;CR0029;FR60","STANDARD"
"manual valve","diaphragm valve","A membrane valve that is a membrane valve where the closure member is a resilient diaphragm being forced against a port.","no","CFIHOS-30000818","yes","Identified as part of RDL Alignment Activity",,"2019-10-01T00:47:46.434Z","2021-10-12T14:57:36.093Z",,"CR0011;CR0029;FR60","STANDARD"
"electric generator","direct current generator","An electric generator for the production of direct current and voltage.","no","CFIHOS-30000819","yes","BP Tagging Specification","DC electric generator; DC generator","2019-10-01T00:47:46.434Z","2021-10-12T14:57:36.093Z",,"CR0009;CR0029;FR60","STANDARD"
"electric motor","direct current motor","An electric motor for operation by direct current.","no","CFIHOS-30000820","yes","BP Tagging Specification","DC electric motor","2019-10-01T00:47:46.434Z","2021-10-12T14:57:36.093Z",,"CR0009;CR0029;FR60","STANDARD"
"process column","distillation column","A process column intended to enable a distillation process.","no","CFIHOS-30000821","yes","missing from CFIHOS - in other OO RDLs",,"2019-10-01T00:47:46.434Z","2021-10-12T14:57:36.093Z",,"CR0013;CR0029;FR60","STANDARD"
"manual valve","double block and bleed valve","A block and bleed valve that is incorporating two seats, each of which provides a seal, and a means of venting the space between the seats. The seats may isolate with the pressure differential acting in the same or in opposite directions depending on the design.","no","CFIHOS-30000822","yes","Identified as part of RDL Alignment Activity",,"2019-10-01T00:47:46.434Z","2021-10-12T14:57:36.093Z",,"CR0011;CR0029;FR60","STANDARD"
"transformer","dry transformer","A power transformer of which the magnetic circuit and windings are not immersed in an insulating liquid.","no","CFIHOS-30000823","yes","missing from CFIHOS - in other OO RDLs",,"2019-10-01T00:47:46.434Z","2021-10-12T14:57:36.093Z",,"CR0012;CR0029;FR60","STANDARD"
"control valve","eccentric rotating disc control valve","A control valve that uses a rotating disc as closing element, and with a design that causes the disc to take a slightly eccentric path during actuation.","no","CFIHOS-30000824","yes","Identified as part of RDL Alignment Activity","actuated eccentric rotating disc valve","2019-10-01T00:47:46.434Z","2021-10-12T14:57:36.093Z",,"CR0011;CR0029;FR60","STANDARD"
"manual valve","eccentric rotating disc valve","A valve that has a closing member which is an eccentric rotating disc.","no","CFIHOS-30000825","yes","Identified as part of RDL Alignment Activity",,"2019-10-01T00:47:46.434Z","2021-10-12T14:57:36.093Z",,"CR0011;CR0029;FR60","STANDARD"
"piping purge unit","electric piping purge unit","An electrically controlled piping system that is situated within the frame and distributes purge gas inside the frame.","no","CFIHOS-30000826","yes","missing from CFIHOS - in other OO RDLs",,"2019-10-01T00:47:46.434Z","2021-10-12T14:57:36.093Z",,"CR0015;CR0029;FR60","STANDARD"
"heat exchanger","finned tube heat exchanger","A heat exchanger that has finned tubes.","no","CFIHOS-30000827","yes","missing from CFIHOS - in other OO RDLs",,"2019-10-01T00:47:46.434Z","2021-10-12T14:57:36.093Z",,"CR0013;CR0029;FR60","STANDARD"
"riser","flexible riser","A flexible vertical or near vertical pipe for the flow of liquid or gas between the seabed and the surface.","no","CFIHOS-30000828","yes","missing from CFIHOS - in other OO RDLs",,"2019-10-01T00:47:46.434Z","2021-10-12T14:57:36.093Z",,"CR0015;CR0029;FR60","STANDARD"
"instrument equipment","flow meter","A detecting instrument intended to measure and indicate flow rate and/or produce a signal which represents the measured flow rate.","yes","CFIHOS-30000829","no","Owner Operator RDL Alignment",,"2019-10-01T00:47:46.434Z","2021-10-12T14:57:36.093Z",,"CR0014;CR0029;FR60","STANDARD"
"flying lead","flying chemical lead","ROV or diver-mateable flexible leads between subsea equipment items for chemical services.","no","CFIHOS-30000830","yes","missing from CFIHOS - in other OO RDLs",,"2019-10-01T00:47:46.434Z","2021-10-12T14:57:36.093Z",,"CR0015;CR0029;FR60","STANDARD"
"flying lead","flying electrical lead","ROV or diver-mateable flexible leads between subsea equipment items for electrical services.","no","CFIHOS-30000831","yes","missing from CFIHOS - in other OO RDLs",,"2019-10-01T00:47:46.434Z","2021-10-12T14:57:36.093Z",,"CR0015;CR0029;FR60","STANDARD"
"flying lead","flying hydraulic lead","ROV or diver-mateable flexible leads between subsea equipment items for hydraulic services.","no","CFIHOS-30000832","yes","missing from CFIHOS - in other OO RDLs",,"2019-10-01T00:47:46.434Z","2021-10-12T14:57:36.093Z",,"CR0015;CR0029;FR60","STANDARD"
"flying lead","flying optical lead","ROV or diver-mateable flexible leads between subsea equipment items for optical services.","no","CFIHOS-30000833","yes","missing from CFIHOS - in other OO RDLs",,"2019-10-01T00:47:46.434Z","2021-10-12T14:57:36.093Z",,"CR0015;CR0029;FR60","STANDARD"
"chromatograph","gas chromatograph","A chromatograph where gas is injected directly into one or more separation columns.","no","CFIHOS-30000834","yes","Owner Operator RDL Alignment",,"2019-10-01T00:47:46.434Z","2021-10-12T14:57:36.093Z",,"CR0014;CR0029;FR60","STANDARD"
"chromatograph","gas liquid chromatograph","A chromatograph where a liquid sample is injected and evaporated and subsequently carried to one or more separation columns.","no","CFIHOS-30000835","yes","Owner Operator RDL Alignment","liquid chromatograph","2019-10-01T00:47:46.434Z","2021-10-12T14:57:36.093Z",,"CR0014;CR0029;FR60","STANDARD"
"circuit-breaker","gas-blast circuit-breaker","A circuit-breaker in which the arc develops in a blast of gas.","no","CFIHOS-30000836","yes","missing from CFIHOS - in other OO RDLs","gas circuit-breaker; gas circuit breaker","2019-10-01T00:47:46.434Z","2021-10-12T14:57:36.093Z",,"CR0012;CR0029;FR60","STANDARD"
"control valve","gate control valve","A control valve that is a gate valve and an actuated valve.","no","CFIHOS-30000837","yes","Identified as part of RDL Alignment Activity","actuated gate valve","2019-10-01T00:47:46.434Z","2021-10-12T14:57:36.093Z",,"CR0011;CR0029;FR60","STANDARD"
"manual valve","gate valve","A valve that is a valve where the closure member is a gate or disc with a linear motion parallel, or nearly parallel, to the plane of flat seats, which are transverse to the direction of flow.","no","CFIHOS-30000838","yes","Identified as part of RDL Alignment Activity",,"2019-10-01T00:47:46.434Z","2021-10-12T14:57:36.093Z",,"CR0011;CR0029;FR60","STANDARD"
"control valve","globe control valve","A control valve that is a globe valve and an actuated valve.","no","CFIHOS-30000839","yes","Identified as part of RDL Alignment Activity","actuated globe valve","2019-10-01T00:47:46.434Z","2021-10-12T14:57:36.093Z",,"CR0011;CR0029;FR60","STANDARD"
"manual valve","globe valve","A valve that is a valve where the closure member is a disc or piston operating with linear motion normal to the flat or shaped seat.","no","CFIHOS-30000840","yes","Identified as part of RDL Alignment Activity",,"2019-10-01T00:47:46.434Z","2021-10-12T14:57:36.093Z",,"CR0011;CR0029;FR60","STANDARD"
"separator","gravity separator","A separator that is based on the difference in specific gravity for the substances to be separated.","no","CFIHOS-30000841","no","missing from CFIHOS - in other OO RDLs",,"2019-10-01T00:47:46.434Z","2021-10-12T14:57:36.093Z",,"CR0013;CR0029;FR60","STANDARD"
"piping purge unit","hydraulic piping purge unit","A hydraulically controlled piping system that is situated within the frame and distributes purge gas inside the frame.","no","CFIHOS-30000842","yes","missing from CFIHOS - in other OO RDLs",,"2019-10-01T00:47:46.434Z","2021-10-12T14:57:36.093Z",,"CR0015;CR0029;FR60","STANDARD"
"turbine","hydraulic turbine","A turbine in which liquid forces are driving the rotor by the reaction of acceleration of subject liquid flow in the runner while the pressure drops.","no","CFIHOS-30000843","yes","BP Reliability, TOTAL Physical Class","liquid expander","2019-10-01T00:47:46.434Z","2021-10-12T14:57:36.093Z",,"CR0009;CR0029;FR60","STANDARD"
"corrosion element","linear polarization resistance element","A detecting element intended to measure corrosion using electrical conductivity.","no","CFIHOS-30000844","yes","Requested by Total","LPR corrosion probe","2019-10-01T00:47:46.434Z","2021-10-12T14:57:36.093Z",,"CR0014;CR0029;FR60","STANDARD"
